{
  "$schema": "https://json-schema.org/draft/2020-12/schema",
  "$id": "https://authweave.dev/contracts/core-problem.v1.schema.json",
  "title": "Core API problem v1",
  "type": "object",
  "additionalProperties": false,
  "required": ["type", "title", "status", "detail", "instance", "code"],
  "properties": {
    "type": { "type": "string", "format": "uri" },
    "title": { "type": "string", "minLength": 1, "maxLength": 200 },
    "status": { "type": "integer", "minimum": 400, "maximum": 599 },
    "detail": { "type": "string", "minLength": 1, "maxLength": 2000 },
    "instance": { "type": "string", "format": "uri-reference" },
    "code": {
      "enum": [
        "invalid-request",
        "invalid-assessment-transition",
        "workspace-not-found",
        "assessment-not-found",
        "catalog-proposal-not-found",
        "catalog-impact-report-not-found",
        "catalog-proposal-replay-unavailable",
        "assessment-version-conflict",
        "profile-upgrade-required",
        "invalid-application-identity-profile"
      ]
    },
    "workspaceId": { "type": "string", "format": "uuid" },
    "assessmentId": { "type": "string", "format": "uuid" },
    "expectedVersion": { "type": "integer", "minimum": 0 },
    "actualVersion": { "type": "integer", "minimum": 0 },
    "violations": {
      "type": "array",
      "minItems": 1,
      "maxItems": 100,
      "items": {
        "type": "object",
        "additionalProperties": false,
        "required": ["path", "message"],
        "properties": {
          "path": { "type": "string", "minLength": 1, "maxLength": 500 },
          "message": { "type": "string", "minLength": 1, "maxLength": 1000 }
        }
      }
    },
    "issues": {
      "type": "array",
      "minItems": 1,
      "maxItems": 100,
      "items": {
        "type": "object",
        "additionalProperties": false,
        "required": ["code", "path", "type", "message"],
        "properties": {
          "code": { "type": "string", "minLength": 1, "maxLength": 200 },
          "path": { "type": "string", "minLength": 1, "maxLength": 500 },
          "type": { "enum": ["CONTRADICTION", "MISSING_INFORMATION"] },
          "message": { "type": "string", "minLength": 1, "maxLength": 1000 }
        }
      }
    }
  }
}
