{
  "type": "urn:authweave:problem:assessment-version-conflict",
  "title": "Assessment version conflict",
  "status": 409,
  "detail": "Assessment 11111111-1111-4111-8111-111111111111 in workspace 22222222-2222-4222-8222-222222222222 has version 1; expected 0",
  "instance": "/api/v1/workspaces/22222222-2222-4222-8222-222222222222/assessments/11111111-1111-4111-8111-111111111111/profile",
  "code": "assessment-version-conflict",
  "workspaceId": "22222222-2222-4222-8222-222222222222",
  "assessmentId": "11111111-1111-4111-8111-111111111111",
  "expectedVersion": 0,
  "actualVersion": 1
}
